<?xml version="1.0" encoding="UTF-8"?>
<!ELEMENT Stores (Store*)>
<!ELEMENT Store (Branch, Phone+)>
<!ELEMENT Branch (#PCDATA)>
<!ELEMENT Phone (Brand, Model, Price, Stock)>
<!ELEMENT Brand (#PCDATA)>
<!ELEMENT Model (#PCDATA)>
<!ELEMENT Price (#PCDATA)>
<!ELEMENT Stock (#PCDATA)>
